{
  "assertion_results": [
    {
      "assertion_id": "border-burgundy-1444",
      "measurement": 0.0,
      "spatial_relation": "border_matches_boundary_hausdorff_lte",
      "status": "pass",
      "tolerance": 1e-06,
      "unit": "coordinate_units"
    },
    {
      "assertion_id": "border-central-europe-1444",
      "measurement": 0.0,
      "spatial_relation": "border_matches_boundary_hausdorff_lte",
      "status": "pass",
      "tolerance": 1e-06,
      "unit": "coordinate_units"
    },
    {
      "assertion_id": "border-france-1444",
      "measurement": 0.0,
      "spatial_relation": "border_matches_boundary_hausdorff_lte",
      "status": "pass",
      "tolerance": 1e-06,
      "unit": "coordinate_units"
    },
    {
      "assertion_id": "border-hre-1444",
      "measurement": 0.0,
      "spatial_relation": "border_matches_boundary_hausdorff_lte",
      "status": "pass",
      "tolerance": 1e-06,
      "unit": "coordinate_units"
    },
    {
      "assertion_id": "border-low-countries-1444",
      "measurement": 0.0,
      "spatial_relation": "border_matches_boundary_hausdorff_lte",
      "status": "pass",
      "tolerance": 1e-06,
      "unit": "coordinate_units"
    },
    {
      "assertion_id": "capital-burgundy-1444",
      "measurement": 1.0,
      "spatial_relation": "capital_within_subject",
      "status": "pass",
      "tolerance": 1,
      "unit": "boolean"
    },
    {
      "assertion_id": "capital-central-europe-1444",
      "measurement": 1.0,
      "spatial_relation": "capital_within_subject",
      "status": "pass",
      "tolerance": 1,
      "unit": "boolean"
    },
    {
      "assertion_id": "capital-france-1444",
      "measurement": 1.0,
      "spatial_relation": "capital_within_subject",
      "status": "pass",
      "tolerance": 1,
      "unit": "boolean"
    },
    {
      "assertion_id": "capital-hre-1444",
      "measurement": 1.0,
      "spatial_relation": "capital_within_subject",
      "status": "pass",
      "tolerance": 1,
      "unit": "boolean"
    },
    {
      "assertion_id": "capital-low-countries-1444",
      "measurement": 1.0,
      "spatial_relation": "capital_within_subject",
      "status": "pass",
      "tolerance": 1,
      "unit": "boolean"
    },
    {
      "assertion_id": "negative-modern-brussels-capital-region",
      "measurement": 0.09865156718879299,
      "spatial_relation": "forbidden_outline_overlap_ratio_lte",
      "status": "pass",
      "tolerance": 0.12,
      "unit": "ratio"
    },
    {
      "assertion_id": "negative-modern-burgundy",
      "measurement": 0.0009469696969697074,
      "spatial_relation": "forbidden_outline_overlap_ratio_lte",
      "status": "pass",
      "tolerance": 0.01,
      "unit": "ratio"
    },
    {
      "assertion_id": "negative-modern-central-europe",
      "measurement": 0.0018952062430323585,
      "spatial_relation": "forbidden_outline_overlap_ratio_lte",
      "status": "pass",
      "tolerance": 0.01,
      "unit": "ratio"
    },
    {
      "assertion_id": "negative-modern-hre",
      "measurement": 0.0006879606879606904,
      "spatial_relation": "forbidden_outline_overlap_ratio_lte",
      "status": "pass",
      "tolerance": 0.01,
      "unit": "ratio"
    },
    {
      "assertion_id": "negative-modern-nord-department",
      "measurement": 0.022260925989308848,
      "spatial_relation": "forbidden_outline_overlap_ratio_lte",
      "status": "pass",
      "tolerance": 0.25,
      "unit": "ratio"
    }
  ],
  "findings": [
    {
      "affected_ids": [
        "frontier-bohemia-habsburg"
      ],
      "code": "BOUNDARY_DATE_OUT_OF_RANGE",
      "message": "frontier-bohemia-habsburg is not valid at 1444-11-11.",
      "severity": "error"
    },
    {
      "affected_ids": [
        "frontier-brabant-liege"
      ],
      "code": "BOUNDARY_DATE_OUT_OF_RANGE",
      "message": "frontier-brabant-liege is not valid at 1444-11-11.",
      "severity": "error"
    },
    {
      "affected_ids": [
        "frontier-cologne-palatinate"
      ],
      "code": "BOUNDARY_DATE_OUT_OF_RANGE",
      "message": "frontier-cologne-palatinate is not valid at 1444-11-11.",
      "severity": "error"
    },
    {
      "affected_ids": [
        "frontier-france-ducal-burgundy"
      ],
      "code": "BOUNDARY_DATE_OUT_OF_RANGE",
      "message": "frontier-france-ducal-burgundy is not valid at 1444-11-11.",
      "severity": "error"
    },
    {
      "affected_ids": [
        "frontier-france-english-calais"
      ],
      "code": "BOUNDARY_DATE_OUT_OF_RANGE",
      "message": "frontier-france-english-calais is not valid at 1444-11-11.",
      "severity": "error"
    },
    {
      "affected_ids": [
        "fabric_manifest"
      ],
      "code": "MISSING_FABRIC_SIDECAR",
      "message": "Missing fabric_manifest: /Users/georgele/projects/games/global-province-map-template/research/start-dates/1444-v1/fabric/location_fabric_manifest.json.",
      "severity": "error"
    },
    {
      "affected_ids": [
        "lineage"
      ],
      "code": "MISSING_FABRIC_SIDECAR",
      "message": "Missing lineage: /Users/georgele/projects/games/global-province-map-template/research/start-dates/1444-v1/fabric/location_lineage.json.",
      "severity": "error"
    },
    {
      "affected_ids": [
        "locations"
      ],
      "code": "MISSING_FABRIC_SIDECAR",
      "message": "Missing locations: /Users/georgele/projects/games/global-province-map-template/research/start-dates/1444-v1/fabric/locations.geojson.",
      "severity": "error"
    },
    {
      "affected_ids": [
        "province_membership"
      ],
      "code": "MISSING_FABRIC_SIDECAR",
      "message": "Missing province_membership: /Users/georgele/projects/games/global-province-map-template/research/start-dates/1444-v1/fabric/province_membership.csv.",
      "severity": "error"
    },
    {
      "affected_ids": [
        "border-burgundy-1444",
        "frontier-france-ducal-burgundy"
      ],
      "code": "POSITIVE_ASSERTION_USES_SOFT_EVIDENCE",
      "message": "border-burgundy-1444 relies on non-constraint evidence.",
      "severity": "error"
    },
    {
      "affected_ids": [
        "border-central-europe-1444",
        "frontier-bohemia-habsburg"
      ],
      "code": "POSITIVE_ASSERTION_USES_SOFT_EVIDENCE",
      "message": "border-central-europe-1444 relies on non-constraint evidence.",
      "severity": "error"
    },
    {
      "affected_ids": [
        "border-france-1444",
        "frontier-france-english-calais"
      ],
      "code": "POSITIVE_ASSERTION_USES_SOFT_EVIDENCE",
      "message": "border-france-1444 relies on non-constraint evidence.",
      "severity": "error"
    },
    {
      "affected_ids": [
        "border-hre-1444",
        "frontier-cologne-palatinate"
      ],
      "code": "POSITIVE_ASSERTION_USES_SOFT_EVIDENCE",
      "message": "border-hre-1444 relies on non-constraint evidence.",
      "severity": "error"
    },
    {
      "affected_ids": [
        "border-low-countries-1444",
        "frontier-brabant-liege"
      ],
      "code": "POSITIVE_ASSERTION_USES_SOFT_EVIDENCE",
      "message": "border-low-countries-1444 relies on non-constraint evidence.",
      "severity": "error"
    }
  ],
  "inputs": {
    "manifest": "/Users/georgele/projects/games/global-province-map-template/research/start-dates/1444-v1/pass_manifest.json",
    "pass_dir": "/Users/georgele/projects/games/global-province-map-template/research/start-dates/1444-v1"
  },
  "milestone": "M24",
  "pass_id": "official-1444-reconstruction-v1",
  "report_type": "start_date_research_qa",
  "schema_version": "0.1.0",
  "start_date": "1444-11-11",
  "status": "fail",
  "summary": {
    "artifact_count": 9,
    "error_count": 14,
    "warning_count": 0
  }
}
